{
  "post_id": "2026-07-08-post-06-palazzo-donn-anna",
  "status": "archived",
  "priority": "high",
  "topic": "Palazzo Donn'Anna",
  "angle": "Palazzo Donn'Anna a Posillipo come rovina barocca sul mare in cui storia e leggenda si sovrappongono: Anna Carafa, Cosimo Fanzago, l'incompiuto, la confusione con Giovanna d’Angiò, amanti scomparsi, fantasmi e caveat tra fonte letteraria e tradizione popolare.",
  "target": {
    "audience": "Pubblico generalista interessato a Napoli, palazzi sul mare, leggende d'amore, rovine e misteri urbani.",
    "goal": "Raccontare la leggenda di Palazzo Donn'Anna distinguendo il luogo reale e documentato dalle varianti popolari su fantasmi, amanti e regina Giovanna.",
    "format": "carousel"
  },
  "editorial_owner": {
    "editor": "redazione",
    "journalist": "Codex",
    "fact_checker": "",
    "designer": ""
  },
  "sources": [
    {
      "source_id": "src-001",
      "title": "NapoliForMe / Comune di Napoli, Donn'Anna Palace",
      "type": "secondary",
      "url": "https://napoliforme.comune.napoli.it/en/pois/-/poi/Donn%E2%80%99Anna-Palace",
      "author": "Comune di Napoli / NapoliForMe",
      "published_at": "",
      "checked_at": "2026-07-08",
      "status": "verified",
      "supports": "Indica Palazzo Donn'Anna come opera barocca di Cosimo Fanzago del 1642, legata ad Anna Carafa di Stigliano, moglie del viceré Guzmán de las Torres; spiega il palazzo ricavato nel banco di tufo sul mare, rimasto incompiuto dopo il ritorno del viceré in Spagna.",
      "caveat": "Fonte istituzionale/turistica sintetica; utile per dati storici essenziali, non per varianti leggendarie.",
      "notes": "Fonte centrale per contesto architettonico e storico."
    },
    {
      "source_id": "src-002",
      "title": "Fondazione Culturale Ezio De Felice, Palazzo Donn'Anna",
      "type": "secondary",
      "url": "https://www.fondazionedefelice.it/palazzo-donnanna-2/",
      "author": "Fondazione Culturale Ezio De Felice",
      "published_at": "",
      "checked_at": "2026-07-08",
      "status": "verified",
      "supports": "Riporta progettazione e costruzione nel 1642 da parte di Cosimo Fanzago per Anna Carafa; menziona il rientro del viceré, la morte di Anna Carafa, l'incompiutezza, il rapporto con il mare e il teatro aperto verso il golfo.",
      "caveat": "Fonte legata a un ente culturale presente nel palazzo; molto utile per architettura e spazi, non prova delle leggende.",
      "notes": "Usare per visual e architettura."
    },
    {
      "source_id": "src-003",
      "title": "FAI, I Luoghi del Cuore, Palazzo Donn'Anna",
      "type": "secondary",
      "url": "https://fondoambiente.it/luoghi/palazzo-donn-anna?ldc=",
      "author": "FAI - Fondo per l'Ambiente Italiano",
      "published_at": "",
      "checked_at": "2026-07-08",
      "status": "verified",
      "supports": "Conferma costruzione per volontà di Anna Carafa, consorte del viceré, stile barocco, incompiutezza e uso attuale come abitazione privata; registra il nesso tra storia, leggenda e mistero.",
      "caveat": "Scheda divulgativa; da affiancare a fonte istituzionale e Fondazione.",
      "notes": "Buona per stato attuale e sintesi."
    },
    {
      "source_id": "src-004",
      "title": "Arte.it, Palazzo Donn'Anna",
      "type": "secondary",
      "url": "https://www.arte.it/guida-arte/napoli/da-vedere/monumento/palazzo-donn-anna-2825",
      "author": "Arte.it",
      "published_at": "",
      "checked_at": "2026-07-08",
      "status": "verified",
      "supports": "Descrive il palazzo progettato nel 1642 da Cosimo Fanzago per Anna Carafa, la posizione scenografica sul litorale di Posillipo e l'aspetto di rudere mai ultimato.",
      "caveat": "Fonte culturale divulgativa; utile per supporto su architettura e paesaggio.",
      "notes": ""
    },
    {
      "source_id": "src-005",
      "title": "Matilde Serao, Leggende napoletane / Il palazzo dogn'Anna, Wikisource",
      "type": "secondary",
      "url": "https://it.wikisource.org/wiki/Leggende_napoletane/Il_palazzo_dogn%27Anna",
      "author": "Matilde Serao",
      "published_at": "1895, edizione digitale Wikisource",
      "checked_at": "2026-07-08",
      "status": "verified",
      "supports": "Testo letterario ottocentesco dedicato alla leggenda di Palazzo Donn'Anna, con Anna Carafa, Donna Mercede de las Torres, Gaetano di Casapesenna, rappresentazione teatrale, gelosia e sparizione.",
      "caveat": "Opera letteraria e folklorica: attesta una versione narrativa, non prova la storicità degli episodi.",
      "notes": "Fonte principale per la variante narrativa da trattare come racconto."
    },
    {
      "source_id": "src-006",
      "title": "Turismo.it, Le leggende tutte al femminile di Palazzo Donn'Anna",
      "type": "secondary",
      "url": "https://www.turismo.it/idee-di-viaggio/cultura-arte/le-leggende-tutte-al-femminile-di-palazzo-donnnanna-id-10890/",
      "author": "Turismo.it",
      "published_at": "2015 circa",
      "checked_at": "2026-07-08",
      "status": "verified",
      "supports": "Riassume la sovrapposizione popolare tra Anna Carafa e Giovanna d’Angiò, le varianti sugli amanti gettati in mare o fatti sparire e il fantasma di Donna Mercede.",
      "caveat": "Fonte divulgativa turistica; utile per registrare varianti, non per claim centrali non verificati.",
      "notes": "Usare solo come supporto sulle varianti popolari."
    },
    {
      "source_id": "src-007",
      "title": "Grandenapoli.it, I fantasmi di Posillipo",
      "type": "secondary",
      "url": "https://grandenapoli.it/i-fantasmi-di-palazzo-donnanna/",
      "author": "Grandenapoli.it",
      "published_at": "2024 circa",
      "checked_at": "2026-07-08",
      "status": "verified",
      "supports": "Racconta la ricezione contemporanea delle leggende di fantasmi a Palazzo Donn'Anna, con motivi di amore, morte e presenze sul mare.",
      "caveat": "Fonte giornalistica/divulgativa recente; non regge da sola i claim, utile per ricezione moderna.",
      "notes": ""
    }
  ],
  "claims": [
    {
      "claim_id": "claim-001",
      "text": "Palazzo Donn'Anna si trova sul litorale di Posillipo e fu progettato nel 1642 da Cosimo Fanzago per Anna Carafa, principessa di Stigliano e moglie del viceré Ramiro de Guzman.",
      "source_ids": [
        "src-001",
        "src-002",
        "src-003",
        "src-004"
      ],
      "evidence": "Comune/NapoliForMe, Fondazione De Felice, FAI e Arte.it concordano su luogo, committenza, Fanzago e datazione al 1642.",
      "caveat": "Dato storico-architettonico generale; verificare eventuali varianti nominali del viceré nei testi.",
      "status": "to_verify",
      "notes": ""
    },
    {
      "claim_id": "claim-002",
      "text": "Il palazzo rimase incompiuto dopo il rientro del viceré in Spagna e la morte di Anna Carafa, assumendo nel tempo l'aspetto di rovina monumentale sul mare.",
      "source_ids": [
        "src-001",
        "src-002",
        "src-003",
        "src-004"
      ],
      "evidence": "Le fonti architettoniche indicano l'incompiutezza e il legame scenografico con il mare di Posillipo.",
      "caveat": "Il motivo della rovina alimenta la leggenda, ma non è di per se una prova di eventi misteriosi.",
      "status": "to_verify",
      "notes": ""
    },
    {
      "claim_id": "claim-003",
      "text": "Matilde Serao dedica una leggenda a Palazzo Donn'Anna, raccontando una trama di teatro, gelosia e sparizione legata a Donna Mercede de las Torres e Gaetano di Casapesenna.",
      "source_ids": [
        "src-005"
      ],
      "evidence": "Il testo Wikisource di Serao contiene il racconto del palazzo e dei personaggi narrativi.",
      "caveat": "È una fonte letteraria ottocentesca: verifica la presenza della versione narrativa, non la storicità degli eventi.",
      "status": "to_verify",
      "notes": ""
    },
    {
      "claim_id": "claim-004",
      "text": "Nella tradizione popolare, la figura di Anna Carafa viene talvolta confusa o sovrapposta a Giovanna d’Angiò, con racconti su amanti scelti tra pescatori e poi fatti sparire.",
      "source_ids": [
        "src-006",
        "src-007"
      ],
      "evidence": "Turismo.it e Grandenapoli registrano varianti popolari su Giovanna, amanti e fantasmi.",
      "caveat": "Varianti tarde e divulgative, spesso in contraddizione con la cronologia storica; da raccontare come sovrapposizione popolare.",
      "status": "to_verify",
      "notes": ""
    },
    {
      "claim_id": "claim-005",
      "text": "Il teatro e le arcate sul mare sono elementi reali del palazzo e contribuiscono alla forza visiva della leggenda.",
      "source_ids": [
        "src-002",
        "src-001"
      ],
      "evidence": "Fondazione De Felice descrive il teatro separato dal mare da tre arcate e ricavato nel tufo; NapoliForMe descrive il palazzo sul banco di tufo a picco sul mare.",
      "caveat": "Claim architettonico/visuale, non leggendario.",
      "status": "to_verify",
      "notes": ""
    },
    {
      "claim_id": "claim-006",
      "text": "Palazzo Donn'Anna e oggi usato come abitazione privata, quindi non va presentato come luogo liberamente visitabile o museo pubblico.",
      "source_ids": [
        "src-003"
      ],
      "evidence": "FAI indica che l'edificio e interamente utilizzato come abitazione privata.",
      "caveat": "Verificare eventuali accessi specifici a spazi culturali della Fondazione; non generalizzare.",
      "status": "to_verify",
      "notes": ""
    }
  ],
  "cover": {
    "headline": "Palazzo Donn'Anna",
    "subheadline": "La rovina sul mare dove Napoli invento i suoi fantasmi",
    "visual_idea": "Palazzo Donn'Anna al tramonto visto dal mare, arcate scure, onde sugli scogli, finestre vuote, presenza femminile appena suggerita da una tenda o riflesso."
  },
  "slides": [
    {
      "slide_number": 1,
      "role": "cover",
      "title": "Palazzo Donn'Anna",